restaurant_name	address	city	postal_code	country	price_range	cuisine_type	description	facilities_services	credit_cards	phone_number	latitude	longitude	monday_hours	tuesday_hours	wednesday_hours	thursday_hours	friday_hours	saturday_hours	sunday_hours	url_micheline	url
Coppola Rossa – Manfredonia - a MICHELIN Guide Restaurant	via Maddalena 28	Manfredonia	71043	ITA	€€	Seafood	Situated in the historic centre not far from the sea, this typical family - run restaurant specialises in fish and seafood. There is an antipasto buffet and a good choice of fish, as well as an open - view grill used in winter for cooking meat dishes.	Air conditioning, Terrace, Wheelchair access	amex, mastercard, visa	+39 0884 582522	41.6267253	15.9154397	closed	12:00-15:15, 19:15-22:15	12:00-15:15, 19:15-22:15	12:00-15:15, 19:15-22:15	12:00-15:15, 19:15-22:15	12:00-15:15, 19:15-22:15	12:00-15:15, 19:15-22:15	https://guide.michelin.com/en/puglia/manfredonia/restaurant/coppola-rossa	https://www.coppolarossamanfredonia.it/
Da Manuela – Isola Sant'Antonio - a MICHELIN Guide Restaurant	frazione Capraglia	Isola Sant'Antonio	15050	ITA	€€	Country cooking	Specialities from Lower Piedmont and the Lomellina region are accompanied by a few freshwater fish dishes and traditional frogs’ legs on the menu at this restaurant, which also offers a fine array of delicious cheeses. The wine selection is also excellent.	Air conditioning, Car park, Garden or park, Interesting wine list, Restaurant offering vegetarian menus, Terrace	amex, mastercard, visa	+39 0131 857177	45.0352935	8.8253002	closed	12:00-14:30, 19:30-23:00	12:00-14:30, 19:30-23:00	12:00-14:30, 19:30-23:00	12:00-14:30, 19:30-23:00	12:00-14:30, 19:30-23:00	12:00-14:30	https://guide.michelin.com/en/piemonte/isola-sant-antonio/restaurant/da-manuela	https://ristorantedamanuela.it/
Hostaria alla Tavernetta – Udine - a MICHELIN Guide Restaurant	via Artico di Prampero 2	Udine	33100	ITA	€€	Regional Cuisine, Traditional Cuisine	This fine restaurant immediately puts you at your ease thanks to a very jovial and friendly atmosphere. The lit fireplace, wood furniture with stylish linen runners and background music make for an excellent break. In addition to traditional courses such as cjarsons or the typical frico, there are more seasonal and Mediterranean fish dishes. Vegan menu available.	Air conditioning, Terrace	amex, dinersclub, mastercard, visa	+39 0432 501066	46.0617002	13.2372018	closed	12:00-15:00, 19:00-23:00	12:00-15:00, 19:00-23:00	12:00-15:00, 19:00-23:00	12:00-15:00, 19:00-23:00	12:00-15:00, 19:00-23:00	closed	https://guide.michelin.com/en/friuli-venezia-giulia/udine/restaurant/hostaria-alla-tavernetta	https://allatavernetta.com/
Il Fagiano – Fasano del Garda - a MICHELIN Guide Restaurant	corso Zanardelli 190	Fasano del Garda	25083	ITA	€€€	Italian Contemporary, Creative	Maurizio Bufi is at the helm of this restaurant, where he creates seasonal regional cuisine that is full of flavour. The extensive options include four tasting menus: Frammenti(the chef’s most iconic dishes), Sensazioni (more creative in style), Equinozio d'autunno(as the name suggests, this menu has an autumnal focus), and Dalla terra(interesting vegetarian options). The atmosphere here is elegant and stylish, whether you sit out on the beautiful terrace in summer or in the warm, atmospheric dining room with its charming coffered ceiling in winter. We particularly enjoyed the iconic fusillone pasta with cuttlefish carpaccio and a Jerusalem artichoke velouté, which was sweet and delicate, and paired with a fresh and intense white Planeta Eruzione 1614 Carricante.	Air conditioning, Car park, Garden or park, Terrace, Wheelchair access	mastercard, visa	+39 0365 290220	45.6227040	10.5703390	19:30-22:00	19:30-22:00	19:30-22:00	19:30-22:00	19:30-22:00	19:30-22:00	19:30-22:00	https://guide.michelin.com/en/lombardia/fasano-del-garda/restaurant/il-fagiano	https://www.ghf.it/restaurants/ristorante-il-fagiano
Trattoria 'petito – Forlì - a MICHELIN Guide Restaurant	via Corridoni 14	Forlì	47121	ITA	€€	Cuisine from Romagna, Seasonal Cuisine	Located on the outskirts of Forlì’s charming historic centre, this simple, modern yet attractive restaurant serves eclectic and varied cuisine. More traditional fare on offer includes an excellent selection of hams and grilled meats, as well as delicious tagliatelle al ragù, while the menu also features a few more creative options including a few fish dishes.	Air conditioning, Car park, Terrace, Wheelchair access	amex, dinersclub, mastercard, visa	+39 0543 35784	44.2179267	12.0461155	12:30-14:30, 19:30-22:30	12:30-14:30, 19:30-22:30	12:30-14:30, 19:30-22:30	12:30-14:30, 19:30-22:30	12:30-14:30, 19:30-22:30	12:30-14:30, 19:30-22:30	closed	https://guide.michelin.com/en/emilia-romagna/forli/restaurant/trattoria-petito	https://www.trattoriapetito.it/
Federico II – Termoli - a MICHELIN Guide Restaurant	via Duomo 30	Termoli	86039	ITA	€€	Seafood	A quiet restaurant right in the historic centre, just a stone’s throw from the cathedral. The young owner prepares creative dishes from the fresh fish and seafood that he purchases on a daily basis.	Air conditioning, Terrace	mastercard, visa	+39 0875 85414	42.0043381	14.9973442	closed	19:30-22:30	19:30-22:30	19:30-22:30	19:30-22:30	12:30-14:30, 19:30-23:00	12:30-16:00	https://guide.michelin.com/en/molise/termoli/restaurant/federico-ii	
La Braja – Montemagno - a MICHELIN Guide Restaurant	via San Giovanni Bosco 11	Montemagno	14030	ITA	€€€	Piedmontese, Traditional Cuisine	A traditional Piedmontese restaurant, where owner Giuseppe Palermino welcomes guests to his elegant dining room with his consummate style. The specialities here have a regional focus with the occasional influence from further afield. The “tajarin al ristretto di coniglio” (shredded rabbit pasta) and the superb cheese trolley are particularly recommended.	Air conditioning, Car park	amex, dinersclub, maestrocard, mastercard, visa	+39 0141 653925	44.9815820	8.3208927	closed	closed	12:30-14:00, 20:00-21:00	12:30-14:00, 20:00-21:00	12:30-14:00, 20:00-21:00	12:30-14:00, 20:00-21:00	12:30-14:00	https://guide.michelin.com/en/piemonte/montemagno/restaurant/la-braja	http://www.ristorantelabraja.it
Patauner – Settequerce - a MICHELIN Guide Restaurant	via Bolzano 6	Settequerce	39018	ITA	€€	Regional Cuisine, Traditional Cuisine	Despite its simple appearance, this restaurant on the side of the road dates from the 17C and has been run by the same family for the past century. Today, the third and fourth generations work side by side in the kitchen, preparing dishes with a strong regional flavour. Highlights include the white Terlano asparagus in season and offal dishes throughout the year.	Car park, Terrace	mastercard, visa	+39 0471 918502	46.5112328	11.2740597	09:30-15:00, 17:30-23:00	09:30-15:00, 17:30-23:00	09:30-15:00, 17:30-23:00	09:30-15:00, 17:30-23:00	09:30-15:00, 17:30-23:00	09:30-15:00, 17:30-23:00	closed	https://guide.michelin.com/en/trentino-alto-adige/settequerce/restaurant/patauner	https://www.restaurant-patauner.net
Bros' – Lecce - a MICHELIN Guide Restaurant	via degli Acaja 2	Lecce	73100	ITA	€€€€	Creative, Contemporary	Bros' is a synonym for a young, free spirit which is full of creativity and imagination, where Floriano Pellegrino and Isabella Potì make the most of their extraordinary energy on two tasting menus that range from 20 to 23 small courses. Their cuisine features innovative and surprising tasting dishes made from local ingredients (many of the courses are finished with a theatrical flourish at your table), all the way through to the excellent desserts, the latter courtesy of Isabella Potì. To a background of modern music, guests are guided on a no-holds-barred journey through the personal gastronomic world of these two exciting chefs. An interesting wine list, which includes a selection of organic and biodynamic labels, and excellent service complete the picture.	Air conditioning, Wheelchair access	amex, dinersclub, mastercard, visa	+39 351 661 5513	40.3517322	18.1727703	closed	20:00-21:00	12:00-13:00, 20:00-21:00	12:00-13:00, 20:00-21:00	12:00-13:00, 20:00-21:00	12:00-13:00, 20:00-21:00	12:00-13:00, 20:00-21:00	https://guide.michelin.com/en/puglia/lecce/restaurant/bros	https://www.pellegrinobrothers.it/
Il Cantinone e Sport Hotel Alpina – Madesimo - a MICHELIN Guide Restaurant	via A. De Giacomi 39	Madesimo	23024	ITA	€€€	Contemporary	A family restaurant run with pride and enthusiasm, Il Cantinone delights guests with its array of local gastronomic delicacies sourced from the surrounding mountains and nearby lake, including ingredients such as buckwheat, trout, whitefish and eel, along with polenta, mushrooms and game. The menu also occasionally features more exotic influences acquired by chef Stefano Masanti during his time spent travelling the world before he returned to his beloved mountains.	Car park, Interesting wine list, Wheelchair access	amex, mastercard, visa	+39 0343 56120	46.4405200	9.3591600	NA	NA	NA	NA	NA	NA	NA	https://guide.michelin.com/en/lombardia/madesimo/restaurant/il-cantinone-e-sport-hotel-alpina	https://ristorantecantinone.com/
Da Nilo – Cetona - a MICHELIN Guide Restaurant	piazza Garibaldi 31	Cetona	53040	ITA	€€	Tuscan	Overlooking the picturesque main square of Cetona, which can be admired from the outdoor tables, this restaurant has a classic ambience. Typical Tuscan cuisine with an emphasis on meat dishes.	Air conditioning, Terrace	amex, dinersclub, mastercard, visa	+39 0578 239040	42.9645008	11.9004364	12:30-14:30, 19:30-21:45	closed	12:30-14:30, 19:30-21:45	12:30-14:30, 19:30-21:45	12:30-14:30, 19:30-21:45	12:30-14:30, 19:30-21:45	12:30-14:30, 19:30-21:45	https://guide.michelin.com/en/toscana/cetona/restaurant/il-tiglio-di-piazza-da-nilo	http://Iltigliodipiazza.it
Quartopiano – Rimini - a MICHELIN Guide Restaurant	via Chiabrera 34/c	Rimini	47924	ITA	€€	Creative, Seafood	Perhaps because of its out - of - the - way location in a business district where you would never normally expect to find a restaurant, this restaurant has made every effort to become one of the best in the region, aided by its skilful and gifted chef. Creative cuisine accompanied by an excellent wine list, with a panoramic roof garden for summer dining.	Air conditioning, Car park, Interesting wine list, Restaurant offering vegetarian menus, Terrace	amex, dinersclub, maestrocard, mastercard, visa	+39 0541 393238	44.0477500	12.5945500	closed	19:30-22:30	19:30-22:30	19:30-22:30	19:30-22:30	19:30-22:30	12:30-14:30	https://guide.michelin.com/en/emilia-romagna/rimini/restaurant/quartopiano-suite-restaurant	https://www.quartopianoristorante.com/
Ristorante Da Anita - Chalet Prà delle Nasse – San Martino di Castrozza - a MICHELIN Guide Restaurant	via Cavallazza 24, località Prà delle Nasse	San Martino di Castrozza	38054	ITA	€€	Regional Cuisine, Alpine	This family-run restaurant is surrounded by views of the Dolomites that are particularly impressive from the outdoor terrace in summer. A historic culinary stalwart among San Martino di Castrozza restaurants, Prà delle Nasse focuses on regional mountain cuisine, although a few more personalised dishes also feature on the menu. The desserts include the grandmother’s traditional tarts alongside more contemporary options.	Car park, Terrace	amex, mastercard, visa	+39 0439 768893	46.2631715	11.7979900	NA	NA	NA	NA	NA	NA	NA	https://guide.michelin.com/en/trentino-alto-adige/san-martino-di-castrozza/restaurant/chalet-pra-delle-nasse-da-anita	https://www.ristorante-da-anita.com/ristorante-da-anita-p14.html
Da Politano – Boves - a MICHELIN Guide Restaurant	via Santuario 125	Boves	12012	ITA	€€	Country cooking, Contemporary	At the kitchen in this restaurant, father-and-son team Claudio and Luca (the latter with experience in numerous renowned restaurants) reinterpret local traditions in their enticing, generous and contemporary-style dishes (fish also features on the menu). The result is top-quality cuisine, which is served by Luca’s friendly and enthusiastic mother Ivana.	Air conditioning, Terrace	mastercard, visa	+39 0171 380383	44.3328613	7.5238243	NA	NA	NA	NA	NA	NA	NA	https://guide.michelin.com/en/piemonte/boves/restaurant/da-politano	http://www.hotelpolitano.it
Antica Osteria del Ponte – Cassinetta di Lugagnano - a MICHELIN Guide Restaurant	piazza Gaetano Negri 9	Cassinetta di Lugagnano	20081	ITA	€€€	Italian Contemporary	This renowned restaurant in Lombardy has made its mark on the history of Italian cuisine and now has a new young couple at the helm and a new classic-contemporary menu. There’s also an interesting and reasonably priced three-dish menu at lunchtime, as well as the option of ordering an informal gastronomic picnic box. The beautiful natural setting of Cassinetta di Lugagnano and its canal completes the picture.	Air conditioning, Terrace, Wheelchair access	amex, dinersclub, mastercard, visa	+39 02 942 0034	45.4259722	8.9098057	closed	12:15-14:15, 19:15-22:15	12:15-14:15, 19:15-22:15	12:15-14:15, 19:15-22:15	12:15-14:15, 19:15-22:15	12:15-14:15, 19:15-22:15	12:15-14:15	https://guide.michelin.com/en/lombardia/cassinetta-di-lugagnano_1804947/restaurant/antica-osteria-del-ponte	http://www.anticaosteriadelponte.it
Scaraboci – Marciana Marina - a MICHELIN Guide Restaurant	via XX Settembre 27	Marciana Marina	57033	ITA	€€	Creative, Seafood	Located just a few metres from the enchanting seafront at Marciana, this restaurant is one of the island’s gastronomic gems, offering a menu that features interesting combinations of beautifully presented meat and especially fish dishes There’s also a private terrace for romantic dining in summer (book well in advance) and although wines are not available by the glass, choosing a top-quality half-bottle is always an option.	Air conditioning, Interesting wine list	dinersclub, mastercard, visa	+39 0565 996868	42.8047200	10.1995800	19:30-22:00	19:30-22:00	19:30-22:00	19:30-22:00	19:30-22:00	19:30-22:00	19:30-22:00	https://guide.michelin.com/en/toscana/marciana-marina/restaurant/scaraboci	
Cacciani – Frascati - a MICHELIN Guide Restaurant	via Diaz 15	Frascati	00044	ITA	€€	Cuisine from Lazio, Classic Cuisine	One of the most famous restaurants in the Castelli Romani region in 2022 celebrated 100 years of life under the management of the same family: the Cacciani. Authentic and excellent regional cuisine, served in a welcoming dining room, with the open - view kitchen on one side and a panoramic terrace on the other.	Air conditioning, Great view, Interesting wine list, Terrace	amex, mastercard, visa	+39 06 942 0378	41.8075835	12.6788993	NA	NA	NA	NA	NA	NA	NA	https://guide.michelin.com/en/lazio/frascati/restaurant/cacciani	https://www.cacciani.it/
Maeba Restaurant – Ariano Irpino - a MICHELIN Guide Restaurant	contrada Serra 29	Ariano Irpino	83031	ITA	€€€	Italian Contemporary	This charming restaurant is built on the site of an old 18C olive oil mill (part of which is still used as a convivial wine cellar) in a secluded and tranquil location. The rest of the building is modern, elegant and colourful, while the delightful outdoor space boasts a garden overlooking the surrounding hills and olive trees. Since early 2024, a former sous-chef here has returned to take over at the helm in the kitchen, where he creates dishes that mirror the modern simplicity of the setting. He offers a carefully prepared blind tasting menu (booking ahead is mandatory and you choose your number of courses when you book) that focuses on local ingredients and makes ample use of vegetables.	Air conditioning, Car park, Garden or park, Interesting wine list, Terrace	amex, dinersclub, mastercard, visa	+39 334 372 7749	41.1211871	15.0655007	closed	12:30-16:30, 19:00-22:30	12:30-16:30, 19:00-22:30	12:30-16:30, 19:00-22:30	12:30-16:30, 19:00-22:30	12:30-16:30, 19:00-22:30	12:30-16:30	https://guide.michelin.com/en/campania/ariano-irpino/restaurant/maeba-restaurant	https://www.maeba.it/
Osteria dal Moro – Giulianova Lido - a MICHELIN Guide Restaurant	lungomare Spalato 74	Giulianova Lido	64021	ITA	€	Cuisine from Abruzzo, Seafood	A lively fish and seafood restaurant on the seafront, which is always busy thanks to its excellent value for money – booking ahead is highly recommended! Fish-based dishes only, all of which are announced at your table and which change regularly depending on market availability. The dishes are simple, rustic but full of flavour, which is why it’s easy to forgive the rather restricted choice of wine.	Air conditioning, Terrace	visa	+39 085 800 4973	42.7482346	13.9734163	13:00-16:00, 20:00-00:00	closed	closed	13:00-16:00, 20:00-00:00	13:00-16:00, 20:00-00:00	13:00-16:00, 20:00-00:00	13:00-16:00, 20:00-00:00	https://guide.michelin.com/en/abruzzo/giulianova-lido/restaurant/osteria-dal-moro	
La Terrazza – Torbole - a MICHELIN Guide Restaurant	via Benaco 24	Torbole	38069	ITA	€€	Seafood, Classic Cuisine	A small indoor dining room and a veranda with a lake view and sliding windows which open completely in summer provide the setting for regionally inspired dishes and lake specialities at this restaurant.	Air conditioning, Great view	amex, dinersclub, mastercard, visa	+39 0464 506083	45.8689645	10.8749638	closed	12:00-14:00, 18:30-21:45	12:00-14:00, 18:30-21:45	12:00-14:00, 18:30-21:45	12:00-14:00, 18:30-21:45	12:00-14:00, 18:30-21:45	12:00-15:00	https://guide.michelin.com/en/trentino-alto-adige/torbole/restaurant/la-terrazza	https://www.allaterrazza.com/
Sichelburg – Pfalzen - a MICHELIN Guide Restaurant	via Castello 1a	Pfalzen	39030	ITA	€€	Creative	Treat yourself to a great meal in an idyllic setting in this village restaurant occupying the first floor of a castle dating back to the 13C. The romantic dining rooms are furnished with wood, while the creative cuisine focuses on typical mountain produce.	Car park, Garden or park, Terrace	maestrocard, mastercard, visa	+39 0474 055603	46.8144957	11.8829237	11:30-15:00, 18:00-23:00	11:30-15:00, 18:00-23:00	closed	closed	11:30-15:00, 18:00-23:00	11:30-15:00, 18:00-23:00	10:00-15:00, 18:00-23:00	https://guide.michelin.com/en/trentino-alto-adige/falzes/restaurant/sichelburg	https://www.sichelburg.it/it/ristorante-alto-adige/
L'Argine a Vencò – Dolegna del Collio - a MICHELIN Guide Restaurant	Località Vencò 15	Dolegna del Collio	34070	ITA	€€€€	Country cooking, Creative	This perfectly restored old mill is home to a chef who creates original cuisine that demonstrates her connection with her region and showcases ingredients grown in the restaurant’s own kitchen garden, especially the aromatic herbs that are a characteristic feature of many of the dishes served here. Antonia Klugmann’s house stands in attractive unspoilt scenery near the Slovenian border and in the middle of two major wine-producing areas, namely the Colli Orientali del Friuli and the better-known Collio, both of which are well represented on the extensive wine list.	Air conditioning, Car park, Interesting wine list, Terrace, Wheelchair access	amex, mastercard, visa	+39 0481 199 9882	46.0025426	13.4631925	closed	closed	19:45-00:00	12:45-16:00, 19:45-00:00	12:45-16:00, 19:45-00:00	12:45-16:00, 19:45-00:00	12:45-16:00, 19:45-00:00	https://guide.michelin.com/en/friuli-venezia-giulia/dolegna-del-collio/restaurant/l-argine-a-venco	https://www.largineavenco.it/
Il Verso del Ghiottone – Dogliani - a MICHELIN Guide Restaurant	via Demagistris 5	Dogliani	12063	ITA	€€	Piedmontese, Seafood	This restaurant in the heart of the historic centre has been set up in an 18C hamlet. The cuisine is strictly traditional but skilfully reinterpreted to take advantage of contemporary tastes.	Terrace, Wheelchair access	amex, maestrocard, mastercard, visa	+39 0173 742074	44.5279714	7.9490561	closed	closed	19:30-21:30	19:30-21:30	19:30-21:30	12:00-14:00, 19:30-21:30	12:00-14:00, 19:30-21:30	https://guide.michelin.com/en/piemonte/dogliani/restaurant/il-verso-del-ghiottone	https://www.ilversodelghiottone.it
Trattoria del Nuovo Macello – Milan - a MICHELIN Guide Restaurant	via Cesare Lombroso 20	Milan	20137	ITA	€€	Lombardian, Modern Cuisine	Named after the slaughterhouse opened opposite the premises in 1927, this restaurant was taken over 30 years later by the grandfather of one of the current partners, as he was convinced that the restaurant’s busy location would contribute to its success – and he wasn’t wrong! The traditional, regional cuisine served here is reinterpreted with a contemporary flavour and includes delicious specialities such as cotoletta alla milanese made from meat matured for 40 days.	Air conditioning	mastercard, visa	+39 02 5990 2122	45.4560446	9.2267357	12:30-14:00, 20:00-22:00	12:30-14:00, 20:00-22:00	12:30-14:00, 20:00-22:00	12:30-14:00, 20:00-22:00	12:30-14:00, 20:00-22:00	20:00-22:00	closed	https://guide.michelin.com/en/lombardia/milano/restaurant/trattoria-del-nuovo-macello	https://www.trattoriadelnuovomacello.it/
Antica Pesa – Rome - a MICHELIN Guide Restaurant	via Garibaldi 18	Rome	00153	ITA	€€	Roman, Cuisine from Lazio	Typical Roman dishes made from carefully selected ingredients grace the menu of this restaurant, which is housed in a grain storehouse that once belonged to the neighbouring Papal State. Large paintings by contemporary artists hang on the walls and there is a small lounge with a fireplace near the entrance.	Air conditioning, Interesting wine list, Terrace	amex, dinersclub, jcb, maestrocard, mastercard, visa	+39 06 580 9236	41.8906000	12.4663800	19:30-23:00	19:30-23:00	19:30-23:00	19:30-23:00	19:30-23:00	19:30-23:00	closed	https://guide.michelin.com/en/lazio/roma/restaurant/antica-pesa	https://www.anticapesa.it/
Osteria dei Vespri – Palermo - a MICHELIN Guide Restaurant	piazza Croce dei Vespri 6	Palermo	90133	ITA	€€€	Modern Cuisine, Seasonal Cuisine	Situated in the palazzo where the famous ball scene in the “The Leopard” by Luchino Visconti was filmed, this restaurant serves cuisine that moves with the times, featuring modern dishes made from local ingredients, while a friendly welcome from the long-established owners adds to the appeal. Cocktails, tapas and simpler yet equally delicious cuisine is served in the Occhiovivo! Bistrot next door, the name of which refers to a Sicilian saying which means “Be careful!”.	Air conditioning, Interesting wine list, Terrace	amex, dinersclub, mastercard, visa	+39 091 617 1631	38.1147580	13.3658272	closed	12:30-14:45, 19:00-22:45	12:30-14:45, 19:00-22:45	12:30-14:45, 19:00-22:45	12:30-14:45, 19:00-22:45	12:30-14:45, 19:00-22:45	closed	https://guide.michelin.com/en/sicilia/palermo/restaurant/osteria-dei-vespri	https://www.osteriadeivespri.it
Riva – Ponte dell'Olio - a MICHELIN Guide Restaurant	via Riva 16	Ponte dell'Olio	29028	ITA	€€	Modern Cuisine	In a small village with a fascinating crenellated castle, this restaurant is run by a husband and wife team. They offer a refined cuisine that is a balanced blend of local recipes and creativity.	Air conditioning, Interesting wine list, Terrace, Wheelchair access	amex, jcb, maestrocard, mastercard, visa	+39 0523 875193	44.8568639	9.6288342	closed	closed	12:00-14:00, 19:30-22:00	12:00-14:00, 19:30-22:00	12:00-14:00, 19:30-22:00	12:00-14:00, 19:30-22:00	12:00-14:00, 19:30-21:30	https://guide.michelin.com/en/emilia-romagna/ponte-dell-olio/restaurant/riva	https://www.ristoranteriva.it
Antica Trattoria del Gallo – Vigano - a MICHELIN Guide Restaurant	via Privata Gerli 3	Vigano	20083	ITA	€€	Lombardian	A splendid example of a country trattoria, which has been delighting its guests with typical dishes from Lombardy for over a century. Meals are served either in the attractive vintage-style dining room or, in fine weather, outdoors under the Virginia creeper and mature wisteria. Truly enchanting!	Air conditioning, Car park, Garden or park, Interesting wine list, Terrace, Wheelchair access	mastercard, visa	+39 02 908 5276	45.3799348	9.0245013	closed	closed	12:30-14:00, 19:30-21:30	12:30-14:00, 19:30-21:30	12:30-14:00, 19:30-21:30	12:30-14:00, 19:30-21:30	12:30-14:00, 19:30-21:30	https://guide.michelin.com/en/lombardia/vigano/restaurant/antica-trattoria-del-gallo	https://www.trattoriadelgallo.com/
Osteria Veglio – La Morra - a MICHELIN Guide Restaurant	frazione Annunziata 9	La Morra	12064	ITA	€	Piedmontese	With its own convenient car park and a large terrace boasting views of the Langhe, this minimalist-style restaurant built in the 1920s serves excellent food. As fans of offal dishes, we were delighted to see lamb kidneys in a Marsala sauce on the menu – a dish which certainly did not disappoint! Guests are required to choose a minimum of two dishes from the à la carte, excluding dessert.	Car park, Great view, Interesting wine list, Terrace	mastercard, visa	+39 0173 509341	44.6372141	7.9552187	closed	12:00-14:30	12:00-14:30	12:00-14:30	12:00-14:30, 19:30-21:15	12:00-14:30, 19:30-21:15	closed	https://guide.michelin.com/en/piemonte/la-morra/restaurant/osteria-veglio	https://www.osteriaveglio.it/
