restaurant_name	address	city	postal_code	country	price_range	cuisine_type	description	facilities_services	credit_cards	phone_number	latitude	longitude	monday_hours	tuesday_hours	wednesday_hours	thursday_hours	friday_hours	saturday_hours	sunday_hours	url_micheline	url
O Me O Il Mare – Gragnano - a MICHELIN Guide Restaurant	Via Roma 45/47	Gragnano	80054	ITA	€€€€	Italian Contemporary, Modern Cuisine	After many years’ experience in Michelin-starred restaurants, Luigi Tramontano and his wife Nicoletta have opened their first restaurant in the chef’s native Gargnano. Previously a pasta factory, the building has been converted into an elegant, contemporary-style restaurant which has nonetheless retained its charming high ceilings. The cuisine is inspired by regional traditions which are reinterpreted to create gourmet dishes, all prepared with respect for the ingredients used and a strong focus on local produce.	Air conditioning, Interesting wine list, Wheelchair access	amex, dinersclub, mastercard, visa	+39 081 620 0550	40.6916293	14.5157334	NA	NA	NA	NA	NA	NA	NA	https://guide.michelin.com/en/campania/gragnano/restaurant/o-me-o-il-mare	http://omeoilmare.com
Alessandro Feo – Marina di Casal Velino - a MICHELIN Guide Restaurant	via Angelo Lista 24	Marina di Casal Velino	84040	ITA	€€	Campanian, Seafood	In a beautiful stone-vaulted building (an old 17C monastery) on the town’s seafront promenade, young owner-chef Alessandro Feo has made his mark in this region that perhaps has fewer gourmet restaurants than many places elsewhere. Here, he creates dishes that combine traditional influences and classic favourites from Campania with his own individual flair and creativity. His focus is on local, seasonal ingredients, including produce from his two kitchen gardens and fish sourced from local fishermen as well as from his own ventures out to sea.		amex, dinersclub, mastercard, visa	+39 328 893 7083	40.1769364	15.1212550	19:30-23:30	19:30-23:30	closed	19:30-23:30	19:30-23:30	19:30-23:30	12:30-14:30, 19:30-23:30	https://guide.michelin.com/en/campania/marina-di-casal-velino/restaurant/alessandro-feo	https://www.alessandrofeoristorante.it/
Dama – Cervesina - a MICHELIN Guide Restaurant	Via Mulino, località San Gaudenzio	Cervesina	27050	ITA	€€€	Modern Cuisine	Situated just a few kilometres from Voghera in the Bassa Lomellina area, this gourmet restaurant run by a young chef occupies the old stables of the Castello di San Gaudenzio. Alongside local specialities such as baked onion and 24-month-old Grana Padano cheese, the menu also features more creative dishes based around authentic recipes. The wine list includes some particularly interesting labels from the Oltrepò region.	Garden or park, Wheelchair access	amex, mastercard, visa	+39 0383 3331	45.0476388	9.0062926	NA	NA	NA	NA	NA	NA	NA	https://guide.michelin.com/en/lombardia/cervesina/restaurant/dama-1213583	https://www.hcsg.it/ristorante/
Il Ristorante Alain Ducasse Napoli – Naples - a MICHELIN Guide Restaurant	Via Cristoforo Colombo 45	Naples	80133	ITA	€€€€	Creative, Mediterranean Cuisine	Alain Ducasse, one of the great names in contemporary fine dining, has arrived in Naples, opening this restaurant in the former premises of the prestigious Ristorante Il Comandante. Situated on the 9th floor of the Romeo hotel overlooking the port, the restaurant boasts fine views of Vesuvius and the Bay of Naples, especially at sunset when the colours are truly spectacular. Meanwhile, the modern dining room, decorated completely in black, is equally as stunning as its surroundings. Alessandro Lucassino, who was born in 1991 and has years of experience working with his mentor, adds a personal flavour to local recipes: by using short cooking times, he preserves the nutritious qualities and flavours of local fish and vegetables while remaining faithful to Ducasse’s “cuisine de la naturalité” philosophy.	Air conditioning, Great view, Interesting wine list	amex, dinersclub, discover, maestrocard, mastercard, visa	+39 081 604 1580	40.8402770	14.2555922	NA	NA	NA	NA	NA	NA	NA	https://guide.michelin.com/en/campania/napoli/restaurant/il-ristorante-alain-ducasse-napoli	https://theromeocollection.com/en/romeo-napoli/restaurants-bars/il-ristorante-alain-ducasse/
Palazzo Utini – Noceto - a MICHELIN Guide Restaurant	via Antonio Gramsci 6	Noceto	43015	ITA	€€€€	Creative, Contemporary	This historic building in the town centre has been brought back to life by the family of local entrepreneurs who bought it years ago and who have given the restaurant their name. Now an exclusive food venue just a stone’s throw from the capital of the “Food Valley” region, Palazzo Utini is home to a bar and bistro on its ground floor, while the first floor is occupied by the gourmet restaurant overseen by chef Enrico Bartolini and run by resident chef Roberto Monopoli who has plenty of culinary experience behind him. Guests can choose individual dishes from the tasting menus à la carte style, plus there’s an extensive wine list. We particularly enjoyed the exquisite turbot saltimbocca and the onion, black cherry and Lambrusco dessert. On the upper floors, elegant and intimate guestrooms are decorated in the same reassuring style as the rest of the building.	Air conditioning, Interesting wine list, Wheelchair access	amex, dinersclub, mastercard, visa	+39 0521 152 1001	44.8087145	10.1788721	NA	NA	NA	NA	NA	NA	NA	https://guide.michelin.com/en/emilia-romagna/noceto_1827072/restaurant/palazzo-utini	https://palazzoutini.com
Soul & Fish – Sorrento - a MICHELIN Guide Restaurant	via Marina Grande	Sorrento	80067	ITA	€€€	Seafood	From the centre of Sorrento, you follow a succession of roads downhill to Marina Grande, the town’s old, picturesque fishing village that is well worth a visit. Here, facing the water, you’ll find Soul & Fish, a seemingly traditional seaside restaurant that actually serves superb fish and seafood on a menu that combines traditional dishes with more creative options.	Terrace	amex, mastercard, visa	+39 081 878 2170	40.6278681	14.3644213	NA	NA	NA	NA	NA	NA	NA	https://guide.michelin.com/en/campania/sorrento/restaurant/soul-fish	https://www.soulandfish.com/
Etra – Genoa - a MICHELIN Guide Restaurant	piazza De Ferrari 4	Genoa	16121	ITA	€€€	Creative, Italian Contemporary	Etra is an anagram of the Italian word “arte” – an apt name for this restaurant, which is housed in Palazzo Doria De Fornari on the beautiful and famous Piazza Ferrari. This palazzo is one of Genova’s magnificent “Rolli” palazzi (noble palaces once used to house famous visitors to the city). Despite the setting, the dining room is modern in style and adorned with elegant works of contemporary art. Here, chef Davide Cannavino consolidates his reputation with a concise menu of creative dishes: around a dozen meat and fish options inspired by the beauty that surrounds him and showcased on two tasting menus from which individual dishes can be chosen à la carte style.	Air conditioning	amex, dinersclub, mastercard, visa	+39 010 731 6733	44.4081985	8.9341693	NA	NA	NA	NA	NA	NA	NA	https://guide.michelin.com/en/liguria/genova/restaurant/etra	https://www.etra.art/
La Trattoria Enrico Bartolini – Castiglione della Pescaia - a MICHELIN Guide Restaurant	Località Badiola	Castiglione della Pescaia	58043	ITA	€€€€	Mediterranean Cuisine, Grills	After a majestic picture-postcard approach via a long avenue lined with cypress trees and maritime pines, passing vineyards and Maremma cattle along the way, you finally arrive at this restaurant which serves trattoria-style cuisine full of intense, familiar and reassuring flavours. The decor here is elegant with the occasional rustic touch, while the service is of the highest level yet pleasantly friendly and informal. Welcome to Bartolini’s Maremma restaurant! Here, resident chef Bruno De Moura Cossio offers a choice of dishes with one common denominator, namely charcoal grilling. All the dishes served here have been grilled in some way, so that they have a distinctive barbecued flavour. However, although the chef’s Brazilian origins are obvious in many different ways, the ingredients are resolutely local, some even from the restaurant’s own farm. The friendly service makes guests feel completely at home, while the excellent wine selection is an added attraction – those produced on the estate itself are highly recommended.	Air conditioning, Car park, Garden or park, Interesting wine list, Terrace	amex, mastercard, visa	+39 0564 944322	42.7882300	10.9712200	NA	NA	NA	NA	NA	NA	NA	https://guide.michelin.com/en/toscana/castiglione-della-pescaia/restaurant/la-trattoria-enrico-bartolini	https://www.enricobartolini.net/ristorante-la-trattoria-castiglione
LoRo – Trescore Balneario - a MICHELIN Guide Restaurant	via Bruse 2	Trescore Balneario	24069	ITA	€€€	Creative	The cuisine served at LoRo is imaginative both in its presentation and its ingredients, which are combined in light, original and healthy (in the best sense of the word) dishes. The focus here is on fish and seafood, especially in the antipasti and primi courses, while all the dishes are listed with imaginative names on the menu. Chef Pierantonio Rocchetti reinterprets classic Italian favourites with flair and imagination, serving generous portions that do not skimp on flavour and taking guests on a delicious culinary journey that culminates in his excellent desserts. The restaurant’s “Sala Lab” is home to a large designer-style table that can be transformed to accommodate different numbers of guests, allowing the chef to prepare his dishes directly at the table in an ambience which is friendly and convivial while still maintaining an elegant feel.	Air conditioning, Car park	amex, maestrocard, mastercard, visa	+39 347 761 4728	45.6938611	9.8324198	closed	12:00-14:00, 19:15-22:00	12:00-14:00, 19:15-22:00	12:00-14:00, 19:15-22:00	12:00-14:00, 19:15-22:00	12:00-14:00, 19:15-22:00	12:00-14:00, 19:15-22:00	https://guide.michelin.com/en/lombardia/trescore-balneario/restaurant/loro	http://www.loroandco.com
20Tre – Genoa - a MICHELIN Guide Restaurant	via David Chiossone 20 r	Genoa	16123	ITA	€€	Farm to table, Modern Cuisine	Situated in the heart of Genoa’s historic centre, this contemporary-style restaurant focuses on just a few dishes, almost all fish-based, presented in a very modern style and in generous portions. Seasonal ingredients and market-fresh produce are the guiding philosophy here.	Air conditioning	amex, dinersclub, mastercard, visa	+39 010 247 6191	44.4087805	8.9331148	12:30-14:00, 20:00-22:00	12:30-14:00, 20:00-22:00	12:30-14:00, 20:00-22:00	12:30-14:00, 20:00-22:00	12:30-14:00, 20:00-22:00	20:00-22:00	closed	https://guide.michelin.com/en/liguria/genova/restaurant/20tre	https://www.ristorante20tregenova.it/
Ménage – Catania - a MICHELIN Guide Restaurant	Via Euplio Reina 13	Catania	95121	ITA	€€	Sicilian, Contemporary	Situated in the heart of the city near the Teatro Bellini and Piazza Università, this restaurant occupies an Art Nouveau-style building. Here, a trio of experienced young chefs from Catania have brought new life to the old “Da Turi Finocchiaro” restaurant, which has always been very popular with the city’s high society. Offering a small outdoor space near the entrance, the quiet, intimate dining room on the ground floor provides the backdrop for reinterpreted, contemporary Sicilian cuisine with an exclusive focus on meat (especially barbecued dishes which are the restaurant’s trademark), while the first floor is home to a cocktail bar run with passion by one of the partners. Two frescoes painted by Giuseppe Barone in 1930 add to the appeal.	Air conditioning, Terrace, Wheelchair access	amex, dinersclub, mastercard, visa	+39 095 0927 2933	37.5040814	15.0880740	NA	NA	NA	NA	NA	NA	NA	https://guide.michelin.com/en/sicilia/catania/restaurant/menage	https://www.menagelounge.it/
Donevandro – Popoli - a MICHELIN Guide Restaurant	via Garibaldi 2	Popoli	65026	ITA	€€	Contemporary, Seasonal Cuisine	Up until a few years ago, the owner-chef at this restaurant was working as a painter – a fact that is evident from the artistic touch in his cuisine. His recipes are modern and personalised, with careful attention naturally paid to harmonious presentation, while the flavour of his dishes is brought out by ingredients that are skilfully chosen from the Abruzzo inland area. In 2024, the restaurant moved to new, centrally located premises which have an intimate feel and are elegant and minimalist in style.	Air conditioning	mastercard, visa	+39 388 887 6858	42.1744979	13.8329115	closed	closed	19:45-21:30	12:45-14:00, 19:45-21:30	12:45-14:00, 19:45-21:30	12:45-14:00, 19:45-21:30	12:45-14:00, 19:45-21:30	https://guide.michelin.com/en/abruzzo/popoli_1845563/restaurant/donevandro	http://www.donevandroristorante.it
Procaccini – Milan - a MICHELIN Guide Restaurant	Via Giulio Cesare Procaccini 33	Milan	20154	ITA	€€€€	Modern Cuisine, Contemporary	Originally from Kosovo, talented chef Emin Haziri grew up in Italy and has plenty of professional culinary experience behind him. Here, he creates contemporary cuisine with a personal flavour, with raw seafood dishes such as oysters, caviar, Sicilian prawns and scampi available alongside his more imaginative options. In the elegant and stylish dining room with a harmonious colour scheme and fine furnishings, the open-view kitchen and marble chef’s table with velvet-covered stools really catch the eye. The restaurant also boasts a cocktail bar where guests can enjoy a drink and appetisers from the small tapas menu which is designed for sharing.	Air conditioning, Restaurant offering vegetarian menus	amex, dinersclub, mastercard, visa	+39 02 7709 1277	45.4837396	9.1708465	NA	NA	NA	NA	NA	NA	NA	https://guide.michelin.com/en/lombardia/milano/restaurant/procaccini	http://procaccini.com
Ape Vino e Cucina – Alba - a MICHELIN Guide Restaurant	Piazza Risorgimento 3	Alba	12051	ITA	€€	Piedmontese, Contemporary	This attractive restaurant in the heart of Alba, the gastronomic capital of the Langhe, is home to chef Damiano Nigro who has previous experience in Michelin-starred restaurants in the area. The restaurant serves aperitif snacks, tapas and top-quality cocktails alongside its delicious, generously portioned meals which, as you might expect in Piedmont, have a traditional flavour. The pasta, bread, desserts and ice-cream are all homemade, while on our last visit in the summer we particularly enjoyed the maccheroncini with scampi and peppers, and the exquisite Fassona beef with a red-wine sauce and seasonal vegetables. Booked ahead is recommended.	Air conditioning, Terrace, Wheelchair access	amex, dinersclub, maestrocard, mastercard, visa	+39 0173 363453	44.7005845	8.0361169	11:30-14:30, 18:00-23:30	closed	closed	11:30-14:30, 18:30-23:30	11:30-14:30, 18:00-23:30	11:30-14:30, 18:00-23:30	11:30-14:30, 18:00-23:30	https://guide.michelin.com/en/piemonte/alba/restaurant/ape-vino-e-cucina	https://www.apewinebar.it/alba/
Da Bob Cook Fish – Sorrento - a MICHELIN Guide Restaurant	largo Parsano vecchio 16	Sorrento	80067	ITA	€€	Seafood	Working in partnership with the nearby fishmongers which supplies it with fresh fish and seafood, this restaurant occupies a building once used for storing oranges that dates back 400 years. Although there is a menu, given the restaurant’s close relationship with the fishmongers we recommend asking the serving staff about the catch of the day and taking a look in the glass cabinet where the fish are displayed. Dishes are classic and traditional, allowing the full flavour of the fresh fish to shine through.	Air conditioning, Terrace	amex, dinersclub, mastercard, visa	+39 081 1778 3873	40.6237252	14.3705831	12:00-15:00, 18:00-23:00	closed	12:00-15:00, 18:00-23:00	12:00-15:00, 18:00-23:00	12:00-15:00, 18:00-23:00	12:00-15:00, 18:00-23:00	12:00-15:00, 18:00-23:00	https://guide.michelin.com/en/campania/sorrento/restaurant/da-bob-cook-fish	https://www.dabobcookfish.com/
DA_MÓ – Matera - a MICHELIN Guide Restaurant	Via Bruno Buozzi 20	Matera	75100	ITA	€€	Regional Cuisine, Contemporary	This new, restored restaurant in the upper part of the Sassi (yet still near the centre of Matera and its car parks) has a warm friendly ambience and boasts a small, charming outdoor space. Here, an entire family (father in the kitchen, mother and daughter front of house), who moved to Matera from Venosa (home of the Latin poet Horatio), serves regional cuisine with a contemporary twist and no little skill and professionalism. Various tasting menus are available, as well as an à la carte. An interesting wine list completes the picture.	Air conditioning, Terrace	amex, dinersclub, mastercard, visa	+39 0835 686548	40.6624784	16.6113483	NA	NA	NA	NA	NA	NA	NA	https://guide.michelin.com/en/basilicata/matera/restaurant/da-mo	https://www.damoristorante.it/
Sa Domu Sarda – Cagliari - a MICHELIN Guide Restaurant	via Sassari 51	Cagliari	09124	ITA	€€	Sardinian	Despite being an island, Sardinia’s traditional cuisine tends to focus on meat dishes, and you’ll find some of its best-known specialities served at this restaurant, with its simple dining rooms and typical local décor. Enjoy evocatively named dishes such as “sitzigorrus cun bagna” (snails in a tomato sauce), Bue Rosso “bombas” (meat balls), delicious Sardinian pastas such as “malloreddus”, “culurgiones” and “fregula”, stews, casseroles and meat fillets, as well as the famous “sebadas” and “su pappai biancu” (a type of blancmange) desserts.	Air conditioning, Terrace	amex, mastercard, visa	+39 070 653400	39.2169379	9.1106285	12:30-15:30, 19:30-23:00	12:30-15:30, 19:30-23:00	12:30-15:30, 19:30-23:00	12:30-15:30, 19:30-23:00	12:30-15:30, 19:30-23:00	12:30-15:30, 19:30-23:00	12:30-15:30, 19:30-23:00	https://guide.michelin.com/en/sardegna/cagliari/restaurant/sa-domu-sarda	https://www.osteriasadomusarda.it/
Charleston – Palermo - a MICHELIN Guide Restaurant	via Generale Magliocco 19	Palermo	90141	ITA	€€€€	Modern Cuisine, Creative	Before it became famous in Mondello, the renowned Charleston started out here in the centre of Palermo – and it has now returned to its origins, occupying the former Mazzara bar, itself once a favourite with locals. The ground floor is home to a café, cocktail bar and bistro, while the contemporary, Sicilian-style restaurant with an elegant summer terrace occupies the first floor (lift available). Here, young chef Gaetano Verde demonstrates all the skills acquired during his time working at renowned restaurants elsewhere in Italy and further afield. His dishes are clear and precise and often prepared using only three main ingredients – a good example is his grilled beef dish which is served with fermented grapes and sesame cream.	Air conditioning, Counter dining, Terrace, Wheelchair access	amex, mastercard, visa	+39 091 450171	38.1215951	13.3569428	NA	NA	NA	NA	NA	NA	NA	https://guide.michelin.com/en/sicilia/palermo/restaurant/charleston	https://casacharleston.net/
Il Tirabusciò – Bibbiena - a MICHELIN Guide Restaurant	via Rosa Scoti 12	Bibbiena	52011	ITA	€€	Tuscan	This restaurant in the heart of the old town is a must for anyone keen to try the cuisine of the Casentino region. The friendly chef is more than happy to provide information on his ingredients and to offer recommendations – the strong flavours in evidence and his delicious cuisine are sure to leave a lasting memory.	Air conditioning	amex, maestrocard, mastercard, visa	+39 0575 595474	43.6950608	11.8175308	closed	closed	12:30-14:00, 19:30-22:00	12:30-14:00, 19:30-22:00	12:30-14:00, 19:30-22:00	12:30-14:00, 19:30-22:00	12:30-14:00, 19:30-22:00	https://guide.michelin.com/en/toscana/bibbiena/restaurant/il-tirabuscio262517	https://www.tirabuscio.it/
La Buca – Cesenatico - a MICHELIN Guide Restaurant	corso Garibaldi 45	Cesenatico	47042	ITA	€€€	Seafood, Contemporary	Choose one of the tables on the outdoor summer terrace (right over the water!) at this restaurant in order to best appreciate its location overlooking the picturesque canal port and its period houses. The indoor dining room is also attractive, with its open-view kitchen and a modern and elegant feel, while the menu focuses almost exclusively on fish, most of which is sourced from local fishermen. Enjoy a wide selection of raw antipasti to start (some simple in their preparation, while others are more elaborate), then choose from an array of beautifully presented, modern dishes, perhaps accompanied by one of the many champagnes included on the wine list.	Air conditioning, Terrace, Wheelchair access	amex, maestrocard, mastercard, visa	+39 0547 675649	44.2003140	12.3968230	closed	19:30-22:30	12:30-14:30, 19:30-22:30	12:30-14:30, 19:30-22:30	12:30-14:30, 19:30-22:30	12:30-14:30, 19:30-22:30	12:30-14:30, 19:30-22:30	https://guide.michelin.com/en/emilia-romagna/cesenatico/restaurant/la-buca130947	https://www.labucaristorante.com/
Luminist Cafè Bistrot – Naples - a MICHELIN Guide Restaurant	via Toledo 177	Naples	80134	ITA	€€	Classic Cuisine	Situated on the ground floor of the splendid Banco di Napoli building that is also home to the Gallerie d'Italia museum, this restaurant also includes a bar and pasticceria. The varied restaurant menu features international dishes (for a quicker meal), fish based around recipes from around the world, alongside more creative dishes and regional specialities from Campania. The latter, from the aubergine parmigiana to the candele pasta served with a Neapolitan ragu, and the popular babà, are truly delicious and showcase all the colours and flavours of Neapolitan cuisine.	Air conditioning, Wheelchair access	amex, unionpay, dinersclub, discover, jcb, maestrocard, mastercard, visa	+39 081 1975 8023	40.8406951	14.2487400	08:00-18:00	08:00-18:00	08:00-18:00	08:00-18:00	08:00-18:00	09:00-23:00	09:00-18:00	https://guide.michelin.com/en/campania/napoli/restaurant/luminist-cafe-bistrot	http://www.giuseppeiannotti.it/Luminist
Il Ristorante - Niko Romito – Rome - a MICHELIN Guide Restaurant	via di Ripetta 73	Rome	00186	ITA	€€€€	Italian Contemporary	Situated on the fifth floor of the Hotel Bulgari with views of the Mausoleum of Augustus, Il Ristorante - Niko Romito boasts a spacious terrace and an elegant, welcoming dining room with mahogany walls adorned with works of art. The menu features traditional Italian cuisine reinterpreted with a light and imaginative touch as demonstrated by memorable dishes such as the chef’s own take on classic spaghetti in a tomato sauce.	Air conditioning, Interesting wine list, Terrace	amex, unionpay, dinersclub, discover, jcb, maestrocard, mastercard, visa	+39 06 3608 0410	41.9067852	12.4758727	12:30-15:00, 19:00-23:00	12:30-15:00, 19:00-23:00	12:30-15:00, 19:00-23:00	12:30-15:00, 19:00-23:00	12:30-15:00, 19:00-23:00	12:30-15:00, 19:00-23:00	12:30-15:00, 19:00-23:00	https://guide.michelin.com/en/lazio/roma/restaurant/il-ristorante-niko-romito-1209165	https://www.bulgarihotels.com/it_IT/rome/dining/il-ristorante-niko-romito
Quintogusto – Savona - a MICHELIN Guide Restaurant	piazza Sandro Pertini 54 r	Savona	17100	ITA	€€	Contemporary, Mediterranean Cuisine	Recently opened in the renovated section of Corso Italia in central Savona, Quintogusto is a small, contemporary and minimalist-style restaurant occupying one side of the former hospital. Here, the owner-chef (once sous-chef at the excellent Michelin-starred Il Vescovado in Noli) cements his reputation with Ligurian-influenced cuisine to which he adds his own modern and imaginative touches.	Air conditioning, Terrace, Wheelchair access	amex, mastercard, visa	+39 019 770 2870	44.3054183	8.4814112	NA	NA	NA	NA	NA	NA	NA	https://guide.michelin.com/en/liguria/savona/restaurant/quintogusto	https://ristorantequintogusto.com/
Locanda delle Tre Chiavi – Isera - a MICHELIN Guide Restaurant	via Vannetti 8	Isera	38060	ITA	€	Regional Cuisine, Seasonal Cuisine	This restaurant housed in an 18C building is run by its talented and enthusiastic owners Sergio (front of house) and Annarita (in the kitchen), who do their utmost to provide guests with the best seasonal, regional ingredients prepared in classic dishes full of flavour. The wine list focuses on good-quality labels from the region.	Car park, Terrace	amex, maestrocard, mastercard, visa	+39 348 402 0857	45.8891800	11.0112600	NA	NA	NA	NA	NA	NA	NA	https://guide.michelin.com/en/trentino-alto-adige/isera/restaurant/locanda-delle-tre-chiavi	http://www.locandadelletrechiavi.it
Musciora – Alghero - a MICHELIN Guide Restaurant	via Mazzini 59	Alghero	07041	ITA	€€€	Sardinian, Modern Cuisine	Located not far from the town centre, this restaurant offers friendly, professional service and three tasting menus including the particularly appealing 8-course “La vera esperienza Musciora”. The dishes here pay tribute to Sardinia’s culinary traditions, while the ingredients are all sourced from the region, as are most of the wines. Highlights include the cuttlefish, potato and pea, and the Su Filindeu pasta (served in a seafood broth).	Air conditioning, Interesting wine list, Terrace	amex, mastercard, visa	+39 079 973 7519	40.5586717	8.3178130	closed	20:00-22:30	20:00-22:30	20:00-22:30	20:00-22:30	13:00-14:30, 20:00-22:30	13:00-14:30, 20:00-22:30	https://guide.michelin.com/en/sardegna/alghero/restaurant/musciora	https://musciora.it/
