restaurant_name	address	city	postal_code	country	price_range	cuisine_type	description	facilities_services	credit_cards	phone_number	latitude	longitude	monday_hours	tuesday_hours	wednesday_hours	thursday_hours	friday_hours	saturday_hours	sunday_hours	url_micheline	url
Cielo – Ostuni - a MICHELIN Guide Restaurant	via Scipione Petrarolo 7	Ostuni	72017	ITA	€€€€	Modern Cuisine, Contemporary	Cielo is the gourmet restaurant at the splendid and aptly named La Sommità hotel, which is housed in a typical old mansion right at the top of this whitewashed town with its limestone steps. The restaurant offers the perfect setting for a romantic summer dinner, either among the citrus trees in the small inner courtyard or in the dining room crowned with a vaulted ceiling. Boasting a highly respectable CV, the chef from Martina Franca serves modern reinterpretations of Puglian cuisine, while the delightful terrace is perfect for an aperitif at sunset. A simpler menu is available at lunchtime.	Air conditioning, Restaurant offering vegetarian menus, Terrace	amex, mastercard, visa	+39 0831 305925	40.7344962	17.5791501	12:30-14:30, 19:30-22:30	12:30-14:30, 19:30-22:30	12:30-14:30, 19:30-22:30	12:30-14:30, 19:30-22:30	12:30-14:30, 19:30-22:30	12:30-14:30, 19:30-22:30	12:30-14:30, 19:30-22:30	https://guide.michelin.com/en/puglia/ostuni/restaurant/cielo	https://www.lasommita.it/
Caino – Montemerano - a MICHELIN Guide Restaurant	via della Chiesa 4	Montemerano	58014	ITA	€€€€	Tuscan, Contemporary	Standing in the centre of a charming Tuscan village, Caino is the gravitational centre of the cuisine of the Maremma, where Valeria Piccini is its proudest ambassador. This skilful chef sources the best ingredients from the region and then extracts every ounce of flavour from them, transforming typical “peasant” recipes and traditions into an extraordinary gastronomic experience on two tasting menus: “Piatti Storici” and “Idee in Movimento”, the latter inspired by an imaginary voyage around the world. Front of house, Valeria is ably assisted by son Andrea, who oversees the well-stocked wine cellar. In summer, the bistro-style Il Giardino di Caino opens on the terrace, serving dishes inspired by old family traditions.	Air conditioning, Interesting wine list	amex, unionpay, dinersclub, discover, jcb, maestrocard, mastercard, visa	+39 0564 602817	42.6220221	11.4906283	19:30-21:30	closed	closed	19:30-21:30	19:30-21:30	12:30-14:30, 19:30-21:30	12:30-14:30, 19:30-21:30	https://guide.michelin.com/en/toscana/montemerano/restaurant/caino	https://www.dacaino.com/
I Sette Consoli – Orvieto - a MICHELIN Guide Restaurant	piazza Sant'Angelo 1/a	Orvieto	05018	ITA	€€	Modern Cuisine, Seasonal Cuisine	In this simple restaurant boasting an attractive outdoor summer garden and splendid views of the Duomo, chef Anna Rita focuses on carefully selected ingredients from the region and beyond. Highlights include soft egg, pan-fried courgettes and spring onions, and pecorino crumble, as well as soft veal rump, Jerusalem artichoke sauce and home-made pickled vegetables. The wine and spirits selection is particularly appealing – as an example, the Orvieto Classico Superiore Doc “Vendemmia Tardiva” is the perfect pairing for your dessert.	Air conditioning, Garden or park, Interesting wine list, Terrace	amex, unionpay, dinersclub, discover, jcb, maestrocard, mastercard, visa	+39 0763 343911	42.7186979	12.1146421	12:30-14:30, 19:30-21:30	12:30-14:30, 19:30-21:30	closed	12:30-14:30, 19:30-21:30	12:30-14:30, 19:30-21:30	12:30-14:30, 19:30-21:30	12:30-14:30	https://guide.michelin.com/en/umbria/orvieto/restaurant/i-sette-consoli	https://www.isetteconsoli.it/
Osteria Borsò Gambrinus – San Polo di Piave - a MICHELIN Guide Restaurant	via Capitello 18	San Polo di Piave	31020	ITA	€€	Venetian, Seasonal Cuisine	A wine bar-cum-osteria with a warm, rustic decor and a menu offering fish and meat dishes, including specialities such as fried scampi, squid, crayfish and vegetables, all seasoned with olive oil. There’s also a good choice of wines by the glass, with a focus on natural wines.	Air conditioning, Car park, Garden or park, Terrace	amex, dinersclub, mastercard, visa	+39 0422 855043	45.7968129	12.3885415	closed	09:00-15:00, 18:00-23:30	09:00-15:00, 18:00-23:30	09:00-15:00, 18:00-23:30	09:00-15:00, 18:00-23:30	09:00-23:30	09:00-20:00	https://guide.michelin.com/en/veneto/san-polo-di-piave/restaurant/osteria-enoteca-gambrinus	https://gambrinus.it/osteria-borso/
Hanswirt – Rablà - a MICHELIN Guide Restaurant	piazza Gerold 3	Rablà	39020	ITA	€€	Regional Cuisine, Classic Cuisine	Situated in an old farmstead, this elegant and pleasant establishment has a warm and typically Tyrolese atmosphere.	Car park, Terrace, Wheelchair access	maestrocard, mastercard, visa	+39 0473 967148	46.6693991	11.0600354	NA	NA	NA	NA	NA	NA	NA	https://guide.michelin.com/en/trentino-alto-adige/rabla/restaurant/hanswirt	https://www.hanswirt.com
Terrazza Costantino – Sclafani Bagni - a MICHELIN Guide Restaurant	rione Sant'Antonio 24	Sclafani Bagni	90020	ITA	€€	Country cooking, Modern Cuisine	In just a few years, young owner-chef Giuseppe Costantino has turned what was once the family trattoria into an elegant restaurant serving delicious reinterpretations of local specialities. There is just one tasting menu which features either meat or fish (although this can be discussed when you make your booking, which is essential). Given the excellent quality of the food here, this menu offers exceptional value for money.	Air conditioning, Terrace	amex, dinersclub, discover, jcb, maestrocard, mastercard, visa	+39 339 115 5915	37.8236762	13.8561003	19:30-22:00	19:30-22:00	closed	19:30-22:00	19:30-22:00	12:30-14:00, 19:30-22:00	12:30-14:00	https://guide.michelin.com/en/sicilia/sclafani-bagni/restaurant/terrazza-costantino	http://www.terrazzacostantino.com
Locanda Perbellini – Milan - a MICHELIN Guide Restaurant	via Moscova 25	Milan	20121	ITA	€€	Italian	Highly renowned in his native Verona, Michelin - starred chef Giancarlo Perbellini has now opened a restaurant in Milan, where he continues to offer traditional Italian cuisine from the north and south of the country, with a nod to new techniques and contemporary trends. Situated in the central Brera district, his warm and welcoming restaurant is small, discreet and, of course, highly elegant.	Air conditioning, Wheelchair access	amex, mastercard, visa	+39 02 3663 1450	45.4767006	9.1897053	closed	12:30-14:30, 19:30-22:30	12:30-14:30, 19:30-22:30	12:30-14:30, 19:30-22:30	12:30-14:30, 19:30-22:30	12:30-14:30, 19:30-22:30	closed	https://guide.michelin.com/en/lombardia/milano/restaurant/locanda-perbellini	https://locandaperbellini.it/
Ai Cadelach – Revine - a MICHELIN Guide Restaurant	via Grava 2	Revine	31020	ITA	€€	Venetian, Traditional Cuisine	Enjoy local cuisine in a rustic - style dining room or alongside the swimming pool in summer. The menu focuses on meat dishes (especially grilled meat), such as traditional Fiorentina steak and Alpago lamb. Wine lovers will appreciate the excellent wine cellar kept by Ezio, one of the restaurant owners.	Car park, Garden or park, Interesting wine list, Terrace	amex, mastercard, visa	+39 0438 523010	45.9975067	12.2470269	NA	NA	NA	NA	NA	NA	NA	https://guide.michelin.com/en/veneto/revine/restaurant/ai-cadelach	https://cadelach.it/
Al Covo – Venice - a MICHELIN Guide Restaurant	campiello della Pescaria, sestiere Castello 3968	Venice	30122	ITA	€€€	Venetian, Seafood	Authentic family hospitality for this renowned restaurant, which makes niche products - mainly seafood - its flagship, even if some land specialties are always present on the menu. Almost all of the vegetables come from the Osti in Orto property garden on the island of Sant'Erasmo.	Air conditioning, Terrace	amex, mastercard, visa	+39 041 522 3812	45.4341740	12.3476275	12:45-14:00, 19:30-22:00	closed	closed	12:45-14:00, 19:30-22:00	12:45-14:00, 19:30-22:00	12:45-14:00, 19:30-22:00	12:45-14:00, 19:30-22:00	https://guide.michelin.com/en/veneto/venezia/restaurant/al-covo	https://www.ristorantealcovo.com/
Sarri – Imperia - a MICHELIN Guide Restaurant	lungomare C. Colombo 108, Borgo Prino	Imperia	18100	ITA	€€€	Seafood, Modern Cuisine	This attractive restaurant boasts a beautiful location in the charming Borgo Prino, a row of houses facing the sea and painted in the pastel shades typical of the region. Liguria’s legendary mild climate means that meals can often be enjoyed outdoors, but if that’s not an option there’s also a charming dining room in an old warehouse decorated in impeccable contemporary style. The faultless, elegant service here is overseen with skill and charm by the chef’s wife, Alessandra. We’ve left the real reason for our enthusiasm until last: owner-chef Andrea Sarri delights guests with his superb cuisine, which features top-quality fish and seafood from the Ligurian Sea, as well as seasonal vegetables and beansprouts grown in organic gardens, all of which result in highly original dishes such as the “vertical” raw fish or the shellfish from Oneglia cooked in a stew with aromatic herbs.	Air conditioning, Interesting wine list, Terrace, Wheelchair access	amex, mastercard, visa	+39 0183 754056	43.8700800	8.0059000	19:30-21:30	19:30-21:30	closed	19:30-21:30	19:30-21:30	12:30-13:30, 19:30-21:30	12:30-13:30, 19:30-21:30	https://guide.michelin.com/en/liguria/imperia/restaurant/sarri	https://www.ristorantesarri.it/
Signum – Malfa - a MICHELIN Guide Restaurant	via Scalo	Malfa	98050	ITA	€€€€	Sicilian, Contemporary	Situated in the Aeolian Islands, this charming inn is home to young chef Martina Caruso who, having practically grown up here, has returned home to take up the reins at Signum after formative experiences elsewhere. Today, this young chef leads a team of nine in the kitchen, while her brother manages the charming hotel built to resemble a typical Aeolian hamlet. Martina knows exactly how to bring out the best of the vibrant ingredients sourced from the region, her own kitchen garden and the nearby sea – she allows the power of these ingredients to shine forth yet manages to make light and playful use of their intense flavours, showcasing their qualities instead of trying to hide them. Luca and cousin Raffaele enhance this gourmet experience with excellent wines (some home-produced), also available by the glass, and superb cocktails.	Air conditioning, Garden or park, Great view, Interesting wine list, Restaurant offering vegetarian menus, Terrace	amex, dinersclub, mastercard, visa	+39 090 984 4222	38.5799200	14.8334400	NA	NA	NA	NA	NA	NA	NA	https://guide.michelin.com/en/sicilia/malfa/restaurant/signum	http://www.hotelsignum.it
Capo Santa Chiara – Genoa - a MICHELIN Guide Restaurant	via al Capo di Santa Chiara 69, Boccadasse	Genoa	16124	ITA	€€€	Seafood, Modern Cuisine	The chef at this modern, renovated restaurant at the end of the romantic Boccadasse beach serves creative cuisine that is the result of years of experimentation. Charming terrace overlooking the sea for summer dining.	Air conditioning, Great view, Terrace, Wheelchair access	amex, dinersclub, mastercard, visa	+39 010 798 1571	44.3897100	8.9748570	closed	12:30-14:00, 19:30-22:00	12:30-14:00, 19:30-22:00	12:30-14:00, 19:30-22:00	12:30-14:00, 19:30-22:00	12:30-14:00, 19:30-22:00	12:30-14:00, 19:30-22:00	https://guide.michelin.com/en/liguria/genova/restaurant/capo-santa-chiara	https://ristorantecaposantachiara.com/
Osteria la Fefa – Finale Emilia - a MICHELIN Guide Restaurant	via Trento-Trieste 9/c	Finale Emilia	41034	ITA	€€	Emilian, Traditional Cuisine	The name “Fefa” is a diminutive of Genoveffa, the female owner who founded this restaurant almost a century ago. Today, the new generation provides streamlined service, decidedly Emilian cuisine and careful attention to wine thanks to talented sommelier Edoardo, who is equally at home recommending a French Côtes-du-Rhône as he is with local Sangiovese labels – the extensive wine list (an entire page is dedicated to magnum bottles) will definitely impress wine-enthusiasts. The “primi” are delicious (don’t miss the classic tortellino in Parmesan cream), as are the “secondi”, which include sweet and sour duck leg in a Lambrusco sauce.	Air conditioning, Interesting wine list, Terrace	mastercard, visa	+39 0535 780202	44.8331758	11.2958166	closed	closed	12:30-15:00, 19:30-23:00	12:30-15:00, 19:30-23:00	12:30-15:00, 19:30-23:00	12:30-15:00, 19:30-23:00	12:30-15:00	https://guide.michelin.com/en/emilia-romagna/finale-emilia/restaurant/osteria-la-fefa	https://www.osterialafefa.it/
Seta by Antonio Guida – Milan - a MICHELIN Guide Restaurant	via Andegari 9	Milan	20121	ITA	€€€€	International, Contemporary	Situated within the Mandarin Oriental hotel, a popular choice for international travellers, this restaurant serves cuisine that reflects the cosmopolitan flavours of Milan. Three tasting menus are available: the first showcases chef Antonio Guida’s classic specialities, the second has a seasonal focus, and the third chooses one particular ingredient as its theme. In spring, different species of oily fish take centre stage including anchovies, spatula fish and bonito served with whelks, kidneys and samphire, all of which are truly delicious! The extensive wine selection features a choice of wines by the glass as well as some excellent magnum options, including a few fine vintages.	Air conditioning, Interesting wine list, Terrace, Wheelchair access	amex, dinersclub, mastercard, visa	+39 02 8731 8897	45.4694121	9.1910082	closed	12:30-14:30, 19:30-22:30	12:30-14:30, 19:30-22:30	12:30-14:30, 19:30-22:30	12:30-14:30, 19:30-22:30	12:30-14:30, 19:30-22:30	closed	https://guide.michelin.com/en/lombardia/milano/restaurant/seta-by-antonio-guida	https://www.mandarinoriental.com/it/milan/la-scala/dine/seta
Trattoria del Pesce – Rome - a MICHELIN Guide Restaurant	via Folco Portinari 27	Rome	00151	ITA	€€	Seafood, Italian	A good selection of fresh and raw fish dishes served in a welcoming, vaguely bistro-style restaurant with young and competent staff. Parking can be difficult, but your patience is definitely rewarded!	Air conditioning	amex, mastercard, visa	+39 349 335 2560	41.8685979	12.4494124	closed	19:30-23:00	19:30-23:00	12:30-14:30, 19:30-23:00	12:30-14:30, 19:30-23:00	12:30-14:30, 19:30-23:00	12:30-14:45, 19:30-23:00	https://guide.michelin.com/en/lazio/roma/restaurant/trattoria-del-pesce	https://www.trattoriadelpesce.it/wp/
Miranda – Riva di Solto - a MICHELIN Guide Restaurant	via Cornello 8	Riva di Solto	24060	ITA	€€	Modern Cuisine, Classic Cuisine	Enjoy year - round dining on the glass - fronted terrace, which overlooks the garden and the beautiful lake. The cuisine here encompasses the whole of Italy, occasionally using ingredients from other countries and continents which combine well in its recipes. Attractive guestrooms, plus a refreshing swimming pool which is available for residents only.	Air conditioning, Car park, Garden or park, Great view, Wheelchair access	amex, mastercard, visa	+39 035 986021	45.7810311	10.0447336	NA	NA	NA	NA	NA	NA	NA	https://guide.michelin.com/en/lombardia/riva-di-solto/restaurant/miranda148125	https://www.hotelristorantemiranda.com/
Manuelina – Recco - a MICHELIN Guide Restaurant	via Roma 296	Recco	16036	ITA	€€	Ligurian, Modern Cuisine	Very few restaurants in Liguria can compete with the long gastronomic tradition of this restaurant, which was named after its original owner back in 1885! It was Manuelina herself who made the typical focaccia of Recco famous, offering it as a dish in her tavern. The fourth generation of the family now runs the business with the same passion and enthusiasm – part of the building houses the typical Focacceria, where family traditions are kept alive, while the other is home to the restaurant itself (even here the legendary and highly recommended focaccia is on the menu) with its round tables. The cuisine is traditional yet with modern touches and based on Ligurian ingredients with a focus on fish (although meat also features).	Air conditioning, Car park, Garden or park, Terrace	amex, mastercard, visa	+39 0185 74128	44.3691057	9.1501288	NA	NA	NA	NA	NA	NA	NA	https://guide.michelin.com/en/liguria/recco/restaurant/manuelina	https://www.manuelinaristorante.it/
Sud – Quarto - a MICHELIN Guide Restaurant	via Santi Pietro e Paolo 8	Quarto	80010	ITA	€€€	Modern Cuisine, Seafood	Closed for refurbishment June-August 2024Quarto has made its mark on the gastronomic map of Italy thanks to Marianna Vitale’s cuisine and the tribute she pays to southern Italian produce, occasionally combined with more exotic ingredients. Once seated at your table, the only choice you have to make is the number of courses you want (rather than the dishes themselves) from two tasting menus of seven or twelve courses designed by the chef. The surprise menus (which take into account any food allergies or intolerances) have a slight focus on fish and seafood.	Air conditioning, Car park, Terrace	amex, dinersclub, mastercard, visa	+39 081 020 2708	40.8748426	14.1234047	closed	closed	closed	19:00-21:30	19:00-21:30	12:00-14:00, 19:00-21:30	12:00-14:00	https://guide.michelin.com/en/campania/quarto/restaurant/sud	https://sudristorante.it/
Bagatto – Loano - a MICHELIN Guide Restaurant	via Ricciardi 24	Loano	17025	ITA	€€	Ligurian, Classic Cuisine	Hidden down an alleyway in the town centre, this friendly trattoria boasts an attractive ceiling with exposed brickwork. An excellent address for fans of Ligurian cuisine, fish and seafood. House desserts include sour orange semifreddo.	Air conditioning, Terrace	amex, mastercard, visa	+39 019 675844	44.1277571	8.2597607	19:30-22:00	12:30-14:30, 19:30-22:00	closed	12:30-14:30, 19:30-22:00	12:30-14:30, 19:30-22:00	12:30-14:30, 19:30-22:00	12:30-14:30, 19:30-22:00	https://guide.michelin.com/en/liguria/loano/restaurant/bagatto	
Osteria la Lanterna – Valsolda - a MICHELIN Guide Restaurant	via Finali 1, frazione Cressogno	Valsolda	22010	ITA	€€	Country cooking, Traditional Cuisine	Situated on the road leading to Lugano in Switzerland, this charming restaurant with elegant furnishings and a rustic decor boasts bright dining rooms and a pleasant terrace for summer dining. The dishes are prepared with a focus on locally sourced, seasonal ingredients and are inspired by traditional recipes reinterpreted in contemporary style.	Terrace	mastercard, visa	+39 0344 69014	46.0244726	9.0722789	12:00-14:30, 19:00-21:30	12:00-14:30, 19:00-21:30	19:00-21:30	12:00-14:30, 19:00-21:30	12:00-14:30, 19:00-21:30	12:00-14:30, 19:00-21:30	12:00-14:30, 19:00-21:30	https://guide.michelin.com/en/lombardia/valsolda/restaurant/osteria-la-lanterna	https://www.osterialalanterna.it
La Madia – Licata - a MICHELIN Guide Restaurant	corso Filippo Re Capriata 22	Licata	92027	ITA	€€€€	Creative, Sicilian	Park in one of the streets near this restaurant and prepare yourself for a delightful journey through Sicily and its culinary traditions! Chef Pino Cuttaia, who is demonstrably in love with his native island, highlights his ingredients in a simple and unfussy way. He uses contemporary techniques, such as in the extremely light mozzarella and tomato dish served at the beginning of the meal, as well as more traditional methods evident in the black Nebrodi suckling pig served with a tomato-based “sugo della Domenica” (Sunday gravy). The two small dining rooms with a modern and minimalist feel offer an attractive setting for this enjoyable culinary experience. Wine-enthusiasts will appreciate the interesting selection of labels (including large bottles popular with connoisseurs). We recommend the 2019 Baglio Cristo di Campobello Adènzia, a red wine with earthy notes and delightful finesse.	Air conditioning, Wheelchair access	amex, mastercard, visa	+39 0922 771443	37.1070131	13.9338055	13:00-14:00, 20:00-22:00	closed	13:00-14:00, 20:00-22:00	13:00-14:00, 20:00-22:00	13:00-14:00, 20:00-22:00	13:00-14:00, 20:00-22:00	13:00-14:00	https://guide.michelin.com/en/sicilia/licata/restaurant/la-madia	https://www.ristorantelamadia.it/
Oscar – Ardenza - a MICHELIN Guide Restaurant	via Franchini 78	Ardenza	57128	ITA	€€	Seafood	Situated off the tourist trail in a charming residential district, this restaurant is popular with locals from Livorno who come here to enjoy the fresh fish on offer – the vast selection on the buffet makes dining here a real treat. In summer, choose a table on the delightful outdoor veranda.	Air conditioning, Terrace, Wheelchair access	amex, maestrocard, mastercard, visa	+39 0586 501258	43.5162510	10.3215893	closed	12:30-15:00, 19:30-23:30	12:30-15:00, 19:30-23:30	12:30-15:00, 19:30-23:30	12:30-15:00, 19:30-23:30	12:30-15:00, 19:30-23:30	12:30-15:00, 19:30-23:30	https://guide.michelin.com/en/toscana/ardenza/restaurant/oscar	https://www.ristoranteoscar.it/
Osteria Frangipane – Trani - a MICHELIN Guide Restaurant	via Maraldo da Trani 5	Trani	76125	ITA	€€	Seafood	This osteria on the edge of the historic centre is run by two young brothers who have one clear aim – to serve local fish dishes which are both delicious and imaginative. Pleasantly informal atmosphere.	Air conditioning	amex, unionpay, dinersclub, discover, jcb, maestrocard, mastercard, visa	+39 0883 585763	41.2783765	16.4105077	closed	13:00-15:00, 20:15-22:30	13:00-15:00, 20:15-23:00	13:00-15:00, 20:15-23:00	13:00-15:00, 20:15-23:00	13:00-15:00, 20:15-23:00	13:00-15:00	https://guide.michelin.com/en/puglia/trani/restaurant/osteria-frangipane	https://osteriafrangipane.it/
Bacucco d'Oro – Mutignano - a MICHELIN Guide Restaurant	via del Pozzo 10	Mutignano	64025	ITA	€	Cuisine from Abruzzo, Traditional Cuisine	From the coast, you take a winding road uphill to this family-run trattoria which boasts sea views from its terrace. Apart from the salted cod, the menu only features meat dishes, with a focus on traditional Abruzzo specialities such as arrosticini (skewered grilled meat) and mazzarelle teramane (lamb offal wrapped in chicory and lettuce).	Car park, Great view, Restaurant offering vegetarian menus, Terrace	mastercard, visa	+39 085 936227	42.5885057	14.0338289	13:00-15:00, 20:00-23:00	13:00-15:00, 20:00-23:00	closed	13:00-15:00, 20:00-23:00	13:00-15:00, 20:00-23:00	13:00-15:00, 20:00-23:00	12:30-15:00	https://guide.michelin.com/en/abruzzo/mutignano/restaurant/bacucco-d-oro	
Acanto – Milan - a MICHELIN Guide Restaurant	piazza della Repubblica 17	Milan	20124	ITA	€€€€	Modern Cuisine, International	Large elegant spaces full of light characterise this modern restaurant which pampers its guests with attentive service and classic cuisine with a contemporary twist.	Air conditioning, Wheelchair access	amex, dinersclub, mastercard, visa	+39 02 6230 2026	45.4793466	9.1964968	12:30-14:30, 19:30-22:30	12:30-14:30, 19:30-22:30	12:30-14:30, 19:30-22:30	12:30-14:30, 19:30-22:30	12:30-14:30, 19:30-22:30	12:30-14:30, 19:30-22:30	12:30-14:30, 19:30-22:30	https://guide.michelin.com/en/lombardia/milano/restaurant/acanto69200	https://www.dorchestercollection.com/it/milan/hotel-principe-di-savoia/ristoranti-e-bar/ristorante-acanto
La Perla del Mare – San Vincenzo - a MICHELIN Guide Restaurant	via della Meloria 9	San Vincenzo	57027	ITA	€€€	Seafood	The occasional creative touch is evident in the fish and seafood dishes served in this welcoming Mediterranean - style restaurant with an attractive outdoor terrace. The restaurant stands right on the beach!	Air conditioning, Great view, Terrace, Wheelchair access	amex, mastercard, visa	+39 0565 702113	43.1061608	10.5391580	12:30-14:00, 20:00-22:00	12:30-14:00, 20:00-22:00	closed	12:30-14:00, 20:00-22:00	12:30-14:00, 20:00-22:00	12:30-14:00, 20:00-22:00	12:30-14:00, 20:00-22:00	https://guide.michelin.com/en/toscana/san-vincenzo/restaurant/la-perla-del-mare	https://laperladelmare.it/
Crocifisso – Noto - a MICHELIN Guide Restaurant	via Principe Umberto 46	Noto	96017	ITA	€€€	Contemporary	Situated near the church of the same name in the upper part of Noto’s historic centre, this restaurant is one of the best in the area. In a modern and minimalist setting, Marco Baglieri serves excellent cuisine with an elaborate and Baroque feel, almost as if he were paying tribute to Noto itself, one of the most fascinating towns in Sicily. An extraordinary dining experience.	Air conditioning, Interesting wine list, Wheelchair access	amex, maestrocard, mastercard, visa	+39 0931 968608	36.8944278	15.0713855	19:30-21:30	19:30-21:30	closed	19:30-21:30	19:30-21:30	19:30-21:30	19:30-21:30	https://guide.michelin.com/en/sicilia/noto/restaurant/crocifisso	https://ristorantecrocifisso.it/
La Conchiglia d'Oro – Pineto - a MICHELIN Guide Restaurant	via Nazionale Adriatica nord	Pineto	64025	ITA	€€	Seafood, Mediterranean Cuisine	The rather anonymous location does not in any way detract from the quality of this historic restaurant, which is renowned for its excellent fish and seafood. The menu showcases fish from the Adriatic cooked using classical techniques with the occasional modern twist, such as in the tuna tartare seasoned with caramelised onions and citrus powder-flavoured mayonnaise. Considering the quality of the fish here, the prices are very reasonable. The beautifully presented desserts are an added bonus.	Air conditioning, Wheelchair access	amex, dinersclub, discover, maestrocard, mastercard, visa	+39 085 949 2333	42.6142651	14.0610184	closed	12:30-14:30, 20:00-22:00	12:30-14:30, 20:00-22:00	12:30-14:30, 20:00-22:00	12:30-14:30, 20:00-22:00	12:30-14:30, 20:00-22:00	12:30-14:30	https://guide.michelin.com/en/abruzzo/pineto/restaurant/la-conchiglia-d-oro	https://www.ristorantelaconchigliadoro.it
